{
  "$schema": "https://json-schema.org/draft/2020-12/schema",
  "$id": "https://schemas.heimgewebe.org/contracts/insights.schema.json",
  "title": "Heimgewebe Review Insight",
  "x-producers": ["semantAH"],
  "x-consumers": ["chronik"],
  "x-related-adrs": ["docs/adrs/0022-erkenntnis-vorlauf-negationsspur.md"],
  "$comment": "ADR-0022: Structural support for negation. Semantics defined in consumer repos.",
  "type": "object",
  "allOf": [
    {
      "if": { "properties": { "type": { "const": "review.insight" } } },
      "then": { "properties": { "relation": false } }
    },
    {
      "if": { "properties": { "type": { "const": "insight.negation" } } },
      "then": { "required": ["relation"] }
    }
  ],
  "additionalProperties": false,
  "required": ["type","repo","source","file","score","verdict","ingested_at"],
  "properties": {
    "id":            { "type":"string", "description":"stable hash/id (optional)" },
    "type":          {
      "type":"string",
      "enum": ["review.insight", "insight.negation"],
      "description": "insight.negation is a meta-insight on an existing insight. Interpretation is out of contract scope."
    },
    "repo":          { "type":"string", "minLength": 1 },
    "source":        { "type":"string", "enum": ["hauski","ci","manual"], "description":"hauski is retained only as a legacy serialized source value; it does not establish a current repository or service." },
    "file":          { "type":"string" },
    "score":         { "type":"integer", "minimum": 0, "maximum": 100 },
    "verdict":       { "type":"string" },
    "pr":            { "type":"string" },
    "tags":          { "type":"array", "items": { "type":"string" } },
    "ingested_at":   { "type":"string", "format": "date-time" },
    "schema_version":{ "type":"string" },
    "source_version":{ "type":"string" },
    "runner_host":   { "type":"string" },
    "bucket":        { "type":"string", "enum": ["info","warn","fail"] },
    "relation": {
      "type": "object",
      "description": "Relational context for insight.negation (thesis ⟂ antithesis)",
      "required": ["thesis", "antithesis"],
      "additionalProperties": false,
      "properties": {
        "thesis": {
          "type": "string",
          "description": "Reference ID to the thesis insight being negated/contrasted"
        },
        "antithesis": {
          "type": "string",
          "description": "Reference ID to the antithesis insight (if external) or self"
        }
      }
    }
  }
}
